warningtype,date,producer,product,reason,state,source,thumbnail,detail_link
  Lebensmittel,23.07.2021,    Bärbel Drexel GmbH  ,Good Night Plus Presslinge,Grenzüberschreitung bzgl. Ethylenoxid,"Baden-Württemberg, Bayern, Nordrhein-Westfalen, Sachsen",,https://www.lebensmittelwarnung.de/bvl-lmw-de/opensaga/attachment/73ac246c-52f9-4a8e-9f04-ce0a666ea9d5/Produktbild64g.png?maxWidth=120&maxHeight=120,https://www.lebensmittelwarnung.de/bvl-lmw-de/detail/lebensmittel/67778
  Lebensmittel,23.07.2021,    Bärbel Drexel GmbH  ,Schlaf gut mit Lavendel Presslinge,Grenzüberschreitung bzgl. Ethylenoxid,"Baden-Württemberg, Bayern, Hessen, Nordrhein-Westfalen",,https://www.lebensmittelwarnung.de/bvl-lmw-de/opensaga/attachment/94a699e9-2c7a-4474-9012-97e6f2cb1818/Produktbild.jpg?maxWidth=120&maxHeight=120,https://www.lebensmittelwarnung.de/bvl-lmw-de/detail/lebensmittel/67783
  Lebensmittel,22.07.2021,    ARDO GmbH  Pempelfurtstraße 1 40880 Ratingen  ,"REWE Beste Wahl, Rahmspinat portioniert mild gewürzt, 500g","Es kann nicht ausgeschlossen werden, dass sich in einzelnen Verpackungen dünne Metallspäne befinden.","Baden-Württemberg, Bayern, Berlin, Brandenburg, Bremen, Hamburg, Hessen, Mecklenburg-Vorpommern, Niedersachsen, Nordrhein-Westfalen, Rheinland-Pfalz, Saarland, Sachsen, Sachsen-Anhalt, Schleswig-Holstein, Thüringen","Verbraucherinformation der ARDO GmbH, Ratingen",https://www.lebensmittelwarnung.de/bvl-lmw-de/opensaga/attachment/d7e24f57-cf99-4e7d-9ed2-c1d90ba4e426/Bild+REWE+Rahmspinat+mild+gew%FCrzt.png?maxWidth=120&maxHeight=120,https://www.lebensmittelwarnung.de/bvl-lmw-de/detail/lebensmittel/67685
  Lebensmittel,20.07.2021,    Fa. Valeacell  ,Valeacell - Alpha Liponsäure 120 Kapseln Kunststoff und Glas,Zu hohe Menge von Alpha-Liponsäure,"Bayern, Hessen, Niedersachsen, Schleswig-Holstein",,https://www.lebensmittelwarnung.de/bvl-lmw-de/opensaga/attachment/e76bba38-42bf-4b5a-a38f-d46a1ad9bc96/Produktbild.png?maxWidth=120&maxHeight=120,https://www.lebensmittelwarnung.de/bvl-lmw-de/detail/lebensmittel/67558
  Lebensmittel,19.07.2021,"    Bio Moringa Oleifera GmbH, Bodendorf 157, A-4223 Katsdorf Österreich  ",Moringa Bio Kapseln,Überhöhter Wert an Ethylenoxid,"Baden-Württemberg, Bayern, Hamburg, Hessen, Niedersachsen, Nordrhein-Westfalen, Sachsen, Sachsen-Anhalt, Schleswig-Holstein, Thüringen","sanitas GmbH & Co. KG, Billerbecker Str. 67, 32839 Steinheim",https://www.lebensmittelwarnung.de/bvl-lmw-de/opensaga/attachment/24b2bb62-0de1-4ce3-b3be-1c0b6cc6d659/Produktfoto.jpg?maxWidth=120&maxHeight=120,https://www.lebensmittelwarnung.de/bvl-lmw-de/detail/lebensmittel/67497
  Lebensmittel,16.07.2021,    Crystal Food GmbH  ,Durra Green freekeh 450 g,Bei Verzehr des Produktes kann es zu Verletzungen durch Kunststoffsplitter kommen.,"Baden-Württemberg, Bayern, Rheinland-Pfalz",,https://www.lebensmittelwarnung.de/bvl-lmw-de/opensaga/attachment/359e70aa-c63b-496d-8923-e2443fadc28e/Produktbild.png?maxWidth=120&maxHeight=120,https://www.lebensmittelwarnung.de/bvl-lmw-de/detail/lebensmittel/67348
  Lebensmittel,16.07.2021,    Dovgan GmbH Hamburg Germany  ,Halva aus Sonnenblumenkernen,Salmonellen in in Halva aus Sonnenblumenkernen,"Baden-Württemberg, Bayern, Berlin, Brandenburg, Bremen, Hamburg, Hessen, Mecklenburg-Vorpommern, Niedersachsen, Nordrhein-Westfalen, Rheinland-Pfalz, Saarland, Sachsen, Sachsen-Anhalt, Schleswig-Holstein, Thüringen",,https://www.lebensmittelwarnung.de/bvl-lmw-de/opensaga/attachment/ca7ac58a-d221-4314-8738-dea92325085c/21-01951front.jpg?maxWidth=120&maxHeight=120,https://www.lebensmittelwarnung.de/bvl-lmw-de/detail/lebensmittel/67346
  Lebensmittel,16.07.2021,    NaturaFit Diätetische Lebensmittelproduktions GmbH  ,Nahrungsergänzungsmittel mit Alpha-Liponsäure 300 R (+),Die aus den Verzehrempfehlungen des Artikels resultierende Tagesdosis überschreitet die sichere tägliche Aufnahmemenge,"Baden-Württemberg, Bayern, Berlin, Brandenburg, Hamburg, Hessen, Niedersachsen, Nordrhein-Westfalen, Rheinland-Pfalz, Saarland, Sachsen, Sachsen-Anhalt, Schleswig-Holstein, Thüringen",,https://www.lebensmittelwarnung.de/bvl-lmw-de/opensaga/attachment/7d7559db-9422-472d-9712-f07f19e1bbdc/Produktbild.png?maxWidth=120&maxHeight=120,https://www.lebensmittelwarnung.de/bvl-lmw-de/detail/lebensmittel/67392
  Lebensmittel,14.07.2021,     TSI Consumer Goods GmbH Vertrieben über die Fa. Lidl  ,"Kania Majoran gerebelt, 10 g",Im Rahmen von einer Eigenuntersuchung wurden Salmonellen festgestellt.,"Baden-Württemberg, Bayern, Berlin, Brandenburg, Bremen, Hamburg, Hessen, Mecklenburg-Vorpommern, Niedersachsen, Nordrhein-Westfalen, Rheinland-Pfalz, Saarland, Sachsen, Sachsen-Anhalt, Schleswig-Holstein, Thüringen",Filialplakat,https://www.lebensmittelwarnung.de/bvl-lmw-de/opensaga/attachment/f76ca1c8-7c28-4d2d-9715-bb72b3cf9e90/Bild+1.PNG?maxWidth=120&maxHeight=120,https://www.lebensmittelwarnung.de/bvl-lmw-de/detail/lebensmittel/67233
  Lebensmittel,14.07.2021,    Orient Gate GmbH Pinkertweg 4 22113 Hamburg  ,"Kreuzkümmel, ganze Körner",Aus Gründen des vorbeugenden Verbraucherschutzes- Befund von Salmonellen -  ruft die Herstellerfirma das Produkt der Marke Abido  (50 g) zurück.,"Baden-Württemberg, Bayern, Berlin, Hamburg, Hessen, Mecklenburg-Vorpommern, Niedersachsen, Nordrhein-Westfalen, Sachsen, Sachsen-Anhalt, Thüringen",,https://www.lebensmittelwarnung.de/bvl-lmw-de/opensaga/attachment/5914a539-645c-4b8d-a07c-b74941c3f851/kreuzk%FCmmel_ganz.jpg?maxWidth=120&maxHeight=120,https://www.lebensmittelwarnung.de/bvl-lmw-de/detail/lebensmittel/67201
  Lebensmittel,13.07.2021,    Kirchner Gewürze GmbH & Co. KG  ,Auftragsgriller,Salmonellen,Bayern,,https://www.lebensmittelwarnung.de/bvl-lmw-de/opensaga/attachment/c8b2e9ea-6aae-494f-baca-f0015b91e783/Produktbild+Auftragsgriller.png?maxWidth=120&maxHeight=120,https://www.lebensmittelwarnung.de/bvl-lmw-de/detail/lebensmittel/67151
  Lebensmittel,13.07.2021,    Kirchner Gewürze GmbH & Co. KG  ,Senfkörner,Salmonellen,"Baden-Württemberg, Bayern, Hessen, Thüringen",Charge auf Bild ist nicht die betroffene Charge! Es dient nur als Beispiel,https://www.lebensmittelwarnung.de/bvl-lmw-de/opensaga/attachment/df4897ce-4245-4c87-b23c-3033d2d877a6/Produktbild+Senfk%F6rner.png?maxWidth=120&maxHeight=120,https://www.lebensmittelwarnung.de/bvl-lmw-de/detail/lebensmittel/67144
  Lebensmittel,13.07.2021,    Kirchner Gewürze GmbH & Co. KG  ,Steakhouse Pfeffer,Salmonellen,Bayern,,https://www.lebensmittelwarnung.de/bvl-lmw-de/opensaga/attachment/d8c8907e-193f-4aff-bd71-00772de635ce/Steakhouse+Pfeffer.png?maxWidth=120&maxHeight=120,https://www.lebensmittelwarnung.de/bvl-lmw-de/detail/lebensmittel/67158
  Lebensmittel,09.07.2021,    McCain GmbH Düsseldorfer Str. 13 65760 Eschborn  ,McCain Pom PomsKnuspriger Kartoffelspaß,"Es kann nicht ausgeschlossen werden, dass sich in einzelnen Verpackungen metallische Fremdkörper befinden.","Berlin, Brandenburg, Bremen, Hamburg, Hessen, Niedersachsen, Nordrhein-Westfalen",Kundeninformation,https://www.lebensmittelwarnung.de/bvl-lmw-de/opensaga/attachment/e32de806-0b1e-4a7c-92d0-54ae495c44d5/Produktbild+McCain.JPG?maxWidth=120&maxHeight=120,https://www.lebensmittelwarnung.de/bvl-lmw-de/detail/lebensmittel/66993
  Lebensmittel,06.07.2021,"     Ciloglu Handels GmbH, Gärtringen  ",SCHWARZE OLIVEN MUCIZE 700 GSCHWARZE OLIVEN MAVI (DUBLE) 700 GSCHWARZE OLIVEN SARI ISTANBUL 500 GSCHWARZE OLIVEN GOLD 700 GSCHWARZE OLIVEN KUPA USLU 1500 GSCHWARZE OLIVEN IZMIR (TURUNCU) 700 G,"Es kann nicht ausgeschlossen werden, dass die oben genannten Produkte mikrobielle und substantielle Abweichungen aufweisen. Es wurden Schimmelpilze festgestellt, d.h. die betroffenen Lebensmittel sind nicht mehr für den Verzehr geeignet.","Baden-Württemberg, Bayern, Berlin, Bremen, Hamburg, Hessen, Mecklenburg-Vorpommern, Niedersachsen, Nordrhein-Westfalen, Rheinland-Pfalz, Schleswig-Holstein, Thüringen",Kundeninformation,https://www.lebensmittelwarnung.de/bvl-lmw-de/opensaga/attachment/e5b3c631-68bb-4568-8913-3d75d16102b8/Bilder.png?maxWidth=120&maxHeight=120,https://www.lebensmittelwarnung.de/bvl-lmw-de/detail/lebensmittel/66877
  Lebensmittel,05.07.2021,    Bärbel Drexel GmbH  ,Good Night Plus Presslinge,Grenzüberschreitung bzgl. Ethylenoxid,"Bayern, Nordrhein-Westfalen",,https://www.lebensmittelwarnung.de/bvl-lmw-de/opensaga/attachment/e8a85c05-e2b6-430d-b387-e714f5f884be/Produktbild.png?maxWidth=120&maxHeight=120,https://www.lebensmittelwarnung.de/bvl-lmw-de/detail/lebensmittel/66803
  Lebensmittel,01.07.2021,"    NV Snack Food Poco Loco, Belgien  Vertrieb MBG Foodservice GmbH  ",HENDERSON AND SONS DIP CHEESE,Verdacht von Glassplittern im Produkt,"Baden-Württemberg, Bayern, Berlin, Bremen, Hamburg, Hessen, Mecklenburg-Vorpommern, Niedersachsen, Nordrhein-Westfalen, Rheinland-Pfalz, Saarland, Sachsen, Sachsen-Anhalt, Thüringen",MBG Foodservice GmbH,https://www.lebensmittelwarnung.de/bvl-lmw-de/opensaga/attachment/4cef2d6e-5afa-48be-b679-02d18b206873/20210630_Presseinformation_HENDERSON_AND_SONS_CHEESE_DIP_R%FCckruf.jpg?maxWidth=120&maxHeight=120,https://www.lebensmittelwarnung.de/bvl-lmw-de/detail/lebensmittel/66743
  Lebensmittel,28.06.2021,"    NV Snack Food Poco Loco, Belgien  Vertrieb Aldi Nord  ",Feurich Salsa Dip Käse,Glassplitter,"Berlin, Brandenburg, Bremen, Hamburg, Hessen, Mecklenburg-Vorpommern, Niedersachsen, Nordrhein-Westfalen, Sachsen, Sachsen-Anhalt, Schleswig-Holstein, Thüringen",NV Snack Food Poco Loco,https://www.lebensmittelwarnung.de/bvl-lmw-de/opensaga/attachment/a3d6665a-c00d-4160-ac6f-c8beb613e90b/Recall_press+release_contamination+glass+DEU.jpg?maxWidth=120&maxHeight=120,https://www.lebensmittelwarnung.de/bvl-lmw-de/detail/lebensmittel/66687
  Lebensmittel,25.06.2021,    Bärbel Drexel GmbH  ,Good Night Plus Presslinge,Grenzüberschreitung bzgl. Ethylenoxid,"Bayern, Nordrhein-Westfalen",,https://www.lebensmittelwarnung.de/bvl-lmw-de/opensaga/attachment/b520aa0e-a776-4a55-8f83-0fd3d4b80e59/Good+Night+Plus.png?maxWidth=120&maxHeight=120,https://www.lebensmittelwarnung.de/bvl-lmw-de/detail/lebensmittel/66578
  Lebensmittel,25.06.2021,    Bärbel Drexel GmbH  ,Schlaf gut mit Lavendel Presslinge,Grenzüberschreitung bzgl. Ethylenoxid,"Bayern, Nordrhein-Westfalen",,https://www.lebensmittelwarnung.de/bvl-lmw-de/opensaga/attachment/f6b99396-19a5-4be3-b448-2483ec82f2b6/Produktbild+Schlaf+Gut+mit+Lavendel.png?maxWidth=120&maxHeight=120,https://www.lebensmittelwarnung.de/bvl-lmw-de/detail/lebensmittel/66586
  Lebensmittel,22.06.2021,    Schweizer  HACO AG  bundesweiter Vertrieb durch die Fa. Lidl  ,"„Kania Fix Nudel-Schinken Gratin“, „Kania Fix Bolognese“ und „Kania Fix für Lasagne“","In Eigenanalysen wurde festgestellt, dass die in den betroffenen Produkten enthaltenen Zwiebeln mit Blei belastet sind.","Baden-Württemberg, Bayern, Berlin, Brandenburg, Bremen, Hamburg, Hessen, Mecklenburg-Vorpommern, Niedersachsen, Nordrhein-Westfalen, Rheinland-Pfalz, Saarland, Sachsen, Sachsen-Anhalt, Schleswig-Holstein, Thüringen",Filialplakat,https://www.lebensmittelwarnung.de/bvl-lmw-de/opensaga/attachment/a5b3664a-b0a6-41e6-8e6d-02be18418fc1/Bild+1.png?maxWidth=120&maxHeight=120,https://www.lebensmittelwarnung.de/bvl-lmw-de/detail/lebensmittel/66404
  Lebensmittel,18.06.2021,    Paul M. Müller GmbH  ,ADRIA Pizza-Tomaten (Polpa di Pomodoro),Mögliche Lackablösungen im Inneren der Konservendosen,"Baden-Württemberg, Bayern, Hamburg, Hessen, Niedersachsen, Nordrhein-Westfalen, Rheinland-Pfalz, Sachsen, Thüringen",,https://www.lebensmittelwarnung.de/bvl-lmw-de/opensaga/attachment/47c5acd0-140a-4a6b-bc91-07a927ec3f23/Produktbild.png?maxWidth=120&maxHeight=120,https://www.lebensmittelwarnung.de/bvl-lmw-de/detail/lebensmittel/66343
  Lebensmittel,07.06.2021,    The GoFoods Company GmbH  Brandshofer Deich 68 20539 Hamburg  ,Eat Real Quinoa & Kale Corn Puffs Jalapeno & Cheddar undEat Real Quinoa Corn Puffs White Cheddar,"Die benannten Eat Reals Puffs Produkte mit den Barcodenummern: 50264894898725026489489841alle Haltbarkeiten bis einschließlich Mai 2022 werden zurückgerufen, da das Produkt möglicherweise Milch enthält, die nicht auf dem Etikett aufgeführt ist und daher ein Risiko für Menschen mit einer Milchallergie darstellt.","Baden-Württemberg, Bayern, Berlin, Brandenburg, Bremen, Hamburg, Hessen, Mecklenburg-Vorpommern, Niedersachsen, Nordrhein-Westfalen, Rheinland-Pfalz, Sachsen, Sachsen-Anhalt, Schleswig-Holstein",,https://www.lebensmittelwarnung.de/bvl-lmw-de/opensaga/attachment/95f1161c-4164-4b47-a162-e8b92c9376d4/21-06-07+R%FCckruf_eatreal_quinoa_puffs-001.jpg?maxWidth=120&maxHeight=120,https://www.lebensmittelwarnung.de/bvl-lmw-de/detail/lebensmittel/66201
  Lebensmittel,27.05.2021,    Ciloglu Handels GmbH Gärtringen  ,schwarze Oliven mit SteinDUBLE SELE ZEYTIN PET 9 x 700 g,mikrobielle und substantielle Abweichungen,"Baden-Württemberg, Bayern, Berlin, Hessen, Niedersachsen, Nordrhein-Westfalen, Rheinland-Pfalz, Schleswig-Holstein, Thüringen",,,https://www.lebensmittelwarnung.de/bvl-lmw-de/detail/lebensmittel/65977
  Lebensmittel,27.05.2021,    Ciloglu Handels GmbH Gärtringen  ,schwarze Oliven mit SteinMUCIZE SELE ZEYTIN 9 x 700 g,mikrobielle und substantielle Abweichungen,"Baden-Württemberg, Bayern, Bremen, Hessen, Niedersachsen, Nordrhein-Westfalen, Rheinland-Pfalz",,,https://www.lebensmittelwarnung.de/bvl-lmw-de/detail/lebensmittel/65982
  Lebensmittel,26.05.2021,    Breathe Solutions GmbH  ,"CBD-Öl 15% ""Relax Me""",erhöhter Delta-9-Tetrahydrocannabinol-Gehalt,"Bayern, Berlin, Hessen, Niedersachsen, Nordrhein-Westfalen",,https://www.lebensmittelwarnung.de/bvl-lmw-de/opensaga/attachment/2c0c4df0-c73d-449c-bfc0-fa3667c5e3cd/Produktfoto.png?maxWidth=120&maxHeight=120,https://www.lebensmittelwarnung.de/bvl-lmw-de/detail/lebensmittel/65923
  Lebensmittel,21.05.2021,     Firma Ciloglu Handels GmbH  ,"KAVALA KURABIYE 12 X 290 g(KEKSE MIT MANDELN)","Es kann nicht ausgeschlossen werden, dass das Produkt Erdnüsse und Haselnüsse enthält, die eine Gesundheitsgefahr für Allergiker darstellen kann.","Baden-Württemberg, Bayern, Berlin, Bremen, Hamburg, Hessen, Mecklenburg-Vorpommern, Niedersachsen, Nordrhein-Westfalen, Rheinland-Pfalz, Sachsen-Anhalt, Schleswig-Holstein",,,https://www.lebensmittelwarnung.de/bvl-lmw-de/detail/lebensmittel/65803
  Lebensmittel,03.05.2021,    Humana Vertriebs GmbH Henrich-Focke-Str. 4 28199 Bremen  ,"Alete bewusst ""Spinat-Käse-Risotto"" Babynahrung","In den genannten Gläsern kann sich anstatt des auf dem Etikett deklarierten Menüs ""Spinat-Käse-Risotto"" das Menü ""Gemüse mit Spaghetti und Pute"" befinden.","Baden-Württemberg, Bayern, Berlin, Brandenburg, Bremen, Hamburg, Hessen, Mecklenburg-Vorpommern, Niedersachsen, Nordrhein-Westfalen, Rheinland-Pfalz, Saarland, Sachsen, Sachsen-Anhalt, Schleswig-Holstein, Thüringen",Alete bewusst,https://www.lebensmittelwarnung.de/bvl-lmw-de/opensaga/attachment/82f1def1-432d-4386-a76a-6498b8b09ca8/AleteBewust-Spinat-Kaese-Risotto-250g.png?maxWidth=120&maxHeight=120,https://www.lebensmittelwarnung.de/bvl-lmw-de/detail/lebensmittel/65444
  Lebensmittel,23.04.2021,"     Deutschland Hecht Pharma GmbH, Zevener Str. 9 in 27432 Bremervörde  ","HUSK Psyllium FLOHSAMENSCHALEN Pulver 200 gHUSK Psyllium FLOHSAMENSCHALEN 225 Kapseln",Mögliche Belastung mit Salmonellen,"Baden-Württemberg, Bayern, Berlin, Bremen, Hamburg, Hessen, Mecklenburg-Vorpommern, Niedersachsen, Nordrhein-Westfalen, Rheinland-Pfalz, Saarland, Sachsen, Sachsen-Anhalt, Schleswig-Holstein, Thüringen",Hecht Pharma GmbH,https://www.lebensmittelwarnung.de/bvl-lmw-de/opensaga/attachment/3cbbb3d8-7131-4c57-be1f-4f23c510f727/Husk_Flohsamenschalen_Pulver_1.jpg?maxWidth=120&maxHeight=120,https://www.lebensmittelwarnung.de/bvl-lmw-de/detail/lebensmittel/65222
  Lebensmittel,21.04.2021,    Weinbergmaier GmbH  ,Bauernland Mediterranes Gemüse,Mögliche Verunreinigung mit Sellerie,"Bayern, Niedersachsen",,https://www.lebensmittelwarnung.de/bvl-lmw-de/opensaga/attachment/a73acb4e-c2e2-4496-a2fc-65765035cc8d/Produktabbildung.jpg?maxWidth=120&maxHeight=120,https://www.lebensmittelwarnung.de/bvl-lmw-de/detail/lebensmittel/65145
  Lebensmittel,21.04.2021,    Dirk Rossmann GmbH Isernhägener Str. 16 30938 Burgwedel  ,enerBiO Tomate Basilikum Streichcreme,Mögliche falsche Auslobung mit Tomate und Basilikum. In den betroffenen Gläsern kann sich fälschlicherweise enerBiO Streich-creme mit Paprika und Cashewnüssen befinden. Cashewnüsse können allergische Reaktionen hervorrufen.,"Baden-Württemberg, Bayern, Berlin, Brandenburg, Bremen, Hessen, Mecklenburg-Vorpommern, Niedersachsen, Nordrhein-Westfalen, Rheinland-Pfalz, Saarland, Sachsen, Sachsen-Anhalt, Schleswig-Holstein, Thüringen",Dirk Rossmann GmbH,https://www.lebensmittelwarnung.de/bvl-lmw-de/opensaga/attachment/aae8f29f-6e11-4b3f-ab61-aa9c49fecd78/4305615677521_FRONT-I.jpg?maxWidth=120&maxHeight=120,https://www.lebensmittelwarnung.de/bvl-lmw-de/detail/lebensmittel/65108
  Lebensmittel,20.04.2021,    Midsona Deutschland GmbH Zur Davert 7 59387 Ascheberg  ,"DAVERT Porridge-Cup Schokolade mit Kakao Nibs 65 g, MHD 01.03.22DAVERT Porridge-Cup Schokolade mit Kakao Nibs 65 g, MHD 26.04.22",Nachweis von Salmonellen in einer Zutat,"Baden-Württemberg, Bayern, Berlin, Brandenburg, Bremen, Hamburg, Hessen, Mecklenburg-Vorpommern, Niedersachsen, Nordrhein-Westfalen, Rheinland-Pfalz, Saarland, Sachsen, Sachsen-Anhalt, Schleswig-Holstein, Thüringen",Midsona Deutschland GmbH,https://www.lebensmittelwarnung.de/bvl-lmw-de/opensaga/attachment/e7ec14a4-6d19-44d2-a64f-1ee70fcdf572/Foto+Porridge+Davert.JPG?maxWidth=120&maxHeight=120,https://www.lebensmittelwarnung.de/bvl-lmw-de/detail/lebensmittel/65036
  Lebensmittel,30.03.2021,"    Markengetränke Schwollen GmbH, Am Sauerbrunnen 25-33, 55767 Schwollen  ","Berg Quelle Medium Mehrweg Glasflasche 0,75l","Es ist nicht auszuschließen, dass Flaschen vereinzelt mit Rückständen von Lösemitteln verunreinigt sind, die sich in Geruchs- und Geschmacksabweichungen äußern können.","Baden-Württemberg, Hessen, Nordrhein-Westfalen, Rheinland-Pfalz, Saarland",Verbraucherinformation,https://www.lebensmittelwarnung.de/bvl-lmw-de/opensaga/attachment/6890a0a8-3f80-4551-85f1-54335297ac88/Berg+Quellen+Mineralwasser+Medium.jpg?maxWidth=120&maxHeight=120,https://www.lebensmittelwarnung.de/bvl-lmw-de/detail/lebensmittel/64647
  Lebensmittel,26.03.2021,"    EIFEL-Quelle GmbH, 56656 Brohl-Lützing  ",EIFEL Quelle Classic,In vereinzelten Flaschen können sich Glasfragmente/Glasgries befinden,"Hessen, Niedersachsen, Nordrhein-Westfalen, Rheinland-Pfalz","EIFEL-Quelle GmbH, 56656 Brohl-Lützing",https://www.lebensmittelwarnung.de/bvl-lmw-de/opensaga/attachment/35e12af0-c728-4e9a-b8b7-23d7bf2a3a4f/FL_0522_EQ+Classic+Front.bmp?maxWidth=120&maxHeight=120,https://www.lebensmittelwarnung.de/bvl-lmw-de/detail/lebensmittel/64563
  Lebensmittel,26.03.2021,    EDEKA ZENTRALE Stiftung & Co. KG  ,"GUT&GÜNSTIG Tiefkühl-Beerenmischung mit Sauerkirschen, 750-g-Beutel","Es ist nicht auszuschließen, dass sich spitze metallische Fremdkörper im Produkt befinden","Hamburg, Niedersachsen, Nordrhein-Westfalen, Rheinland-Pfalz",,https://www.lebensmittelwarnung.de/bvl-lmw-de/opensaga/attachment/f1f440e2-7194-4f20-bba5-f65fa26ce5a0/G&G+Beerenmischung+TK.jpg?maxWidth=120&maxHeight=120,https://www.lebensmittelwarnung.de/bvl-lmw-de/detail/lebensmittel/64549
  Lebensmittel,22.03.2021,    Orient Lebensmittel GmbH Hauptstr. 53 58452 Witten  Themra Herbal Hal Mah. T. Özal Bulv. No24 Yeni  Hal Kompleksi Toptancılar Sitesi Z Blok  No 29-30-31 Akdeniz / MERSİN Türkei  ,THEMRA - Epimedyumlu Bitkisel Karisimli Macun-Paste(Paste auf Honig/Zucker-Basis mit Kräutern),Das Produkt enthält den verschreibungspflichtigen Wirkstoff „Sildenafil“ in pharmakologisch wirksamer Menge sowie die für Lebensmittel nicht zugelassene Zutat „Epimedium“.,"Baden-Württemberg, Bayern, Bremen, Hamburg, Hessen, Mecklenburg-Vorpommern, Niedersachsen, Nordrhein-Westfalen, Rheinland-Pfalz, Saarland, Sachsen, Sachsen-Anhalt, Schleswig-Holstein, Thüringen",Orient Lebensmittel GmbH,https://www.lebensmittelwarnung.de/bvl-lmw-de/opensaga/attachment/89cc277b-ed8f-4ab5-a5cc-86e35de3cf0b/Abbildung.jpg?maxWidth=120&maxHeight=120,https://www.lebensmittelwarnung.de/bvl-lmw-de/detail/lebensmittel/64502
  Lebensmittel,04.03.2021,    Adalat Berlin Deutschland  ,getrocknete Minzblätter,Salmonellen,"Berlin, Brandenburg",Kundenaushang,https://www.lebensmittelwarnung.de/bvl-lmw-de/opensaga/attachment/ce779882-bc23-412c-9eee-9f25768903a8/Produktbild.PNG?maxWidth=120&maxHeight=120,https://www.lebensmittelwarnung.de/bvl-lmw-de/detail/lebensmittel/64162
  Lebensmittel,23.02.2021,"    Auhof, Fam. Pfisterer & Hauser, 88719 Stetten  ",Seccohne,"Das Getränk schäumt beim Öffnen stark über, da es gärt.Durch die Gärung kann die Flasche zerbrechen.Das Getränk ist nicht mehr alkoholfrei.","Baden-Württemberg, Bayern",,https://www.lebensmittelwarnung.de/bvl-lmw-de/opensaga/attachment/557e3d9c-8369-43b0-8b6d-bd4e6ea35875/Unbenannt.PNG?maxWidth=120&maxHeight=120,https://www.lebensmittelwarnung.de/bvl-lmw-de/detail/lebensmittel/63906
  Lebensmittel,18.02.2021,"    EUCO GmbH, 22291 Hamburg  ",Ming Chu Sushi-Reis,"Es kann nicht ausgeschlossen werden, dass sich einzelne Glasstücke in den Sushi-Reis Packungen befinden.","Baden-Württemberg, Bayern, Berlin, Brandenburg, Bremen, Hamburg, Hessen, Mecklenburg-Vorpommern, Niedersachsen, Nordrhein-Westfalen, Rheinland-Pfalz, Saarland, Sachsen, Sachsen-Anhalt, Schleswig-Holstein, Thüringen",EDEKA AG,https://www.lebensmittelwarnung.de/bvl-lmw-de/opensaga/attachment/adf57db7-665d-4ed2-9447-6b923861101b/Produktbild.JPG?maxWidth=120&maxHeight=120,https://www.lebensmittelwarnung.de/bvl-lmw-de/detail/lebensmittel/63769
  Lebensmittel,18.02.2021,    Unidex B.V.  ,Zena Moringa Powder,Salmonellen,"Baden-Württemberg, Bayern, Berlin, Nordrhein-Westfalen, Sachsen-Anhalt",,https://www.lebensmittelwarnung.de/bvl-lmw-de/opensaga/attachment/942b73a7-bd9e-4b11-b435-85b97c032ea2/2021_02_18SmaakversterkerMoringapowderFAVV_foto.jpg?maxWidth=120&maxHeight=120,https://www.lebensmittelwarnung.de/bvl-lmw-de/detail/lebensmittel/63826
  Lebensmittel,10.02.2021,    SSP Trade & Consult GmbH Philipp-Reis-Str. 15 B3/B4 63128 Dietzenbach  ,"Shiitake Donko, getrocknete Shiitake-Pilze, 50 g, Artikel J013Shiitake Donko, getrocknete Shiitake-Pilze, 1 kg, Artikel J002","Erhöhter Schwefeldioxidgehalt, fehlende Kennzeichnung des Allergens Schwefeldioxid","Baden-Württemberg, Bayern, Berlin, Hessen, Nordrhein-Westfalen, Saarland, Sachsen",SSP Trade & Consult GmbH,https://www.lebensmittelwarnung.de/bvl-lmw-de/opensaga/attachment/96b6485b-0d1d-40be-bb3b-2068e103cb9a/R%FCckruf+Artikel+J013+Shiitake+Donko+50g+-+01.02.jpg?maxWidth=120&maxHeight=120,https://www.lebensmittelwarnung.de/bvl-lmw-de/detail/lebensmittel/63479
  Lebensmittel,09.02.2021,    LVG Lebensmittelvertriebs-GmbH Aldrup 3 27793 Wildeshausen  ,"REWE Beste Wahl, Kartoffelrösti, 600g",Fremdkörper (transparente Hartplastikteile),"Baden-Württemberg, Bayern, Berlin, Brandenburg, Bremen, Hamburg, Hessen, Mecklenburg-Vorpommern, Niedersachsen, Nordrhein-Westfalen, Rheinland-Pfalz, Sachsen, Sachsen-Anhalt, Schleswig-Holstein, Thüringen",LVG Lebensmittelvertriebs-GmbH,https://www.lebensmittelwarnung.de/bvl-lmw-de/opensaga/attachment/39bd3521-7308-443e-a9f3-f90971f47071/3D+Rewe+Beste+Wahl+R%F6sti+(2).jpg?maxWidth=120&maxHeight=120,https://www.lebensmittelwarnung.de/bvl-lmw-de/detail/lebensmittel/63442
  Lebensmittel,05.02.2021,    Firma Ardo N.V.  ,"Grilled red & yellow peppers parilla - SlicesRote und gelbe Paprika Parilla, gegrillt - Scheiben",Erhöhter Gehalt an Chlorpyrifos,"Baden-Württemberg, Bayern, Hessen, Niedersachsen, Nordrhein-Westfalen, Sachsen-Anhalt, Schleswig-Holstein, Thüringen",,https://www.lebensmittelwarnung.de/bvl-lmw-de/opensaga/attachment/e0d8c997-be52-4e90-addf-ba01055c2d10/Produktabbildung.jpg?maxWidth=120&maxHeight=120,https://www.lebensmittelwarnung.de/bvl-lmw-de/detail/lebensmittel/63347
  Lebensmittel,20.01.2021,"    KAR GmbH Piccoloministr.22 51063 Köln  ",SULTAN Susam / SULTAN Sesamsamen geschält,In den betroffenen Produkten der Marke SULTAN wurden Sesamsamen mit erhöhtem Gehalt an Ethylenoxid verarbeitet.,"Baden-Württemberg, Bayern, Hamburg, Hessen, Nordrhein-Westfalen, Rheinland-Pfalz, Saarland",Fa. KAR GmbH,https://www.lebensmittelwarnung.de/bvl-lmw-de/opensaga/attachment/a8109d5d-9e66-4297-ae93-fe066159db3c/Beispielfoto_85g.jpg?maxWidth=120&maxHeight=120,https://www.lebensmittelwarnung.de/bvl-lmw-de/detail/lebensmittel/62645
  Lebensmittel,08.01.2021,"     Edeka AG Hamburg  ","EDEKA Bio Heidelbeere in Birne, 190 g-Glas(MHD 28.07.2022)","Aus Gründen des vorbeugenden Verbraucherschutzes wird der Artikel ""Edeka Bio Heidelbeere in Birne nach dem 4. Monat"" im 190-Gramm-Glas aufgrund eines Fremdkörper (Glasstücke) zurück gerufen.","Baden-Württemberg, Bayern, Berlin, Brandenburg, Bremen, Hamburg, Hessen, Mecklenburg-Vorpommern, Niedersachsen, Nordrhein-Westfalen, Rheinland-Pfalz, Saarland, Sachsen, Sachsen-Anhalt, Schleswig-Holstein, Thüringen",,https://www.lebensmittelwarnung.de/bvl-lmw-de/opensaga/attachment/ec010978-81f7-41e3-b929-d9aaef0343ac/EDEKA+Bio+Heidelbeere+in+Birne.jpg?maxWidth=120&maxHeight=120,https://www.lebensmittelwarnung.de/bvl-lmw-de/detail/lebensmittel/62466
